{
  "anchorsFormat": "lattice-minting-anchors/1",
  "unicodeVersion": "16.0.0",
  "ucdSource": "https://www.unicode.org/Public/16.0.0/ucd/",
  "description": "Hand-authored anchor vectors. Every byte is recomputed by verify-anchors.sh with openssl, sharing no code with the LATTICE minting libraries. Normalization outputs cite the UCD 16.0.0 lines that justify them.",
  "sets": [
    {
      "vectorsFormat": "lattice-minting-vectors/1",
      "description": "Derived hash: the SKU example of rdf-sparql-patterns-guide.md Chapter 5.",
      "recipe": {
        "recipeFormat": "lattice-minting-recipe/1",
        "role": "EntityRole",
        "target": {
          "class": "https://example.org/lending#Product",
          "deployment": null
        },
        "strategy": "DerivedHashIdentity",
        "iriTemplate": "urn:ex:sku:{digest}",
        "key": {
          "properties": [
            "https://example.org/lending#sku"
          ],
          "scopeProperty": null,
          "pipeline": {
            "id": "NfkcTrimUppercase",
            "unicodeVersion": "16.0.0",
            "steps": [
              "reject_unassigned",
              "strip_format",
              "nfkc",
              "trim_white_space",
              "uppercase_full",
              "nfkc"
            ]
          }
        },
        "tuplePrefix": [
          "iri",
          "v1",
          "sku"
        ],
        "tupleEncoding": "length-prefixed-utf8/1",
        "digest": {
          "function": "SHA-256",
          "widthBits": 160,
          "encoding": "base32"
        },
        "recipeDigest": "sha256:b371788209398065d2085751da33f3ab61d2f0d99777a00925dcac18a4a0031b"
      },
      "testSecrets": {},
      "positive": [
        {
          "id": "dh-ascii",
          "category": "ascii",
          "inputs": {
            "key": [
              "widget-9"
            ]
          },
          "trace": [
            {
              "step": "normalize",
              "component": 0,
              "pipeline": "NfkcTrimUppercase",
              "input": "widget-9",
              "after": [
                {
                  "step": "reject_unassigned",
                  "output": "widget-9"
                },
                {
                  "step": "strip_format",
                  "output": "widget-9"
                },
                {
                  "step": "nfkc",
                  "output": "widget-9"
                },
                {
                  "step": "trim_white_space",
                  "output": "widget-9"
                },
                {
                  "step": "uppercase_full",
                  "output": "WIDGET-9"
                },
                {
                  "step": "nfkc",
                  "output": "WIDGET-9"
                }
              ],
              "output": "WIDGET-9",
              "ucd": []
            },
            {
              "step": "tuple",
              "components": [
                "iri",
                "v1",
                "sku",
                "WIDGET-9"
              ],
              "hex": "333a697269323a7631333a736b75383a5749444745542d39"
            },
            {
              "step": "digest",
              "function": "SHA-256",
              "hex": "b823783f51e7dfe63cab9d45cd6958849de216ccda6bf467e5c7c753ec1bb0f5"
            },
            {
              "step": "truncate",
              "widthBits": 160,
              "hex": "b823783f51e7dfe63cab9d45cd6958849de216cc"
            },
            {
              "step": "encode",
              "encoding": "base32",
              "value": "XARXQP2R47P6MPFLTVC422KYQSO6EFWM"
            },
            {
              "step": "render",
              "iri": "urn:ex:sku:XARXQP2R47P6MPFLTVC422KYQSO6EFWM"
            }
          ],
          "iri": "urn:ex:sku:XARXQP2R47P6MPFLTVC422KYQSO6EFWM"
        },
        {
          "id": "dh-trim-case",
          "category": "whitespace-and-case",
          "inputs": {
            "key": [
              " Widget-9 "
            ]
          },
          "trace": [
            {
              "step": "normalize",
              "component": 0,
              "pipeline": "NfkcTrimUppercase",
              "input": " Widget-9 ",
              "after": [
                {
                  "step": "reject_unassigned",
                  "output": " Widget-9 "
                },
                {
                  "step": "strip_format",
                  "output": " Widget-9 "
                },
                {
                  "step": "nfkc",
                  "output": " Widget-9 "
                },
                {
                  "step": "trim_white_space",
                  "output": "Widget-9"
                },
                {
                  "step": "uppercase_full",
                  "output": "WIDGET-9"
                },
                {
                  "step": "nfkc",
                  "output": "WIDGET-9"
                }
              ],
              "output": "WIDGET-9",
              "ucd": [
                "PropList.txt 0020 ; White_Space"
              ]
            },
            {
              "step": "tuple",
              "components": [
                "iri",
                "v1",
                "sku",
                "WIDGET-9"
              ],
              "hex": "333a697269323a7631333a736b75383a5749444745542d39"
            },
            {
              "step": "digest",
              "function": "SHA-256",
              "hex": "b823783f51e7dfe63cab9d45cd6958849de216ccda6bf467e5c7c753ec1bb0f5"
            },
            {
              "step": "truncate",
              "widthBits": 160,
              "hex": "b823783f51e7dfe63cab9d45cd6958849de216cc"
            },
            {
              "step": "encode",
              "encoding": "base32",
              "value": "XARXQP2R47P6MPFLTVC422KYQSO6EFWM"
            },
            {
              "step": "render",
              "iri": "urn:ex:sku:XARXQP2R47P6MPFLTVC422KYQSO6EFWM"
            }
          ],
          "iri": "urn:ex:sku:XARXQP2R47P6MPFLTVC422KYQSO6EFWM"
        },
        {
          "id": "dh-fullwidth",
          "category": "compatibility-forms",
          "inputs": {
            "key": [
              "\uff57idget-\uff19"
            ]
          },
          "trace": [
            {
              "step": "normalize",
              "component": 0,
              "pipeline": "NfkcTrimUppercase",
              "input": "\uff57idget-\uff19",
              "after": [
                {
                  "step": "reject_unassigned",
                  "output": "\uff57idget-\uff19"
                },
                {
                  "step": "strip_format",
                  "output": "\uff57idget-\uff19"
                },
                {
                  "step": "nfkc",
                  "output": "widget-9"
                },
                {
                  "step": "trim_white_space",
                  "output": "widget-9"
                },
                {
                  "step": "uppercase_full",
                  "output": "WIDGET-9"
                },
                {
                  "step": "nfkc",
                  "output": "WIDGET-9"
                }
              ],
              "output": "WIDGET-9",
              "ucd": [
                "DerivedNormalizationProps.txt FF57 NFKC compatibility -> 0077",
                "UnicodeData.txt FF19 <wide> 0039"
              ]
            },
            {
              "step": "tuple",
              "components": [
                "iri",
                "v1",
                "sku",
                "WIDGET-9"
              ],
              "hex": "333a697269323a7631333a736b75383a5749444745542d39"
            },
            {
              "step": "digest",
              "function": "SHA-256",
              "hex": "b823783f51e7dfe63cab9d45cd6958849de216ccda6bf467e5c7c753ec1bb0f5"
            },
            {
              "step": "truncate",
              "widthBits": 160,
              "hex": "b823783f51e7dfe63cab9d45cd6958849de216cc"
            },
            {
              "step": "encode",
              "encoding": "base32",
              "value": "XARXQP2R47P6MPFLTVC422KYQSO6EFWM"
            },
            {
              "step": "render",
              "iri": "urn:ex:sku:XARXQP2R47P6MPFLTVC422KYQSO6EFWM"
            }
          ],
          "iri": "urn:ex:sku:XARXQP2R47P6MPFLTVC422KYQSO6EFWM"
        },
        {
          "id": "dh-format-stripped",
          "category": "format",
          "inputs": {
            "key": [
              "Wid\u200bget\u00ad-9"
            ]
          },
          "trace": [
            {
              "step": "normalize",
              "component": 0,
              "pipeline": "NfkcTrimUppercase",
              "input": "Wid\u200bget\u00ad-9",
              "after": [
                {
                  "step": "reject_unassigned",
                  "output": "Wid\u200bget\u00ad-9"
                },
                {
                  "step": "strip_format",
                  "output": "Widget-9"
                },
                {
                  "step": "nfkc",
                  "output": "Widget-9"
                },
                {
                  "step": "trim_white_space",
                  "output": "Widget-9"
                },
                {
                  "step": "uppercase_full",
                  "output": "WIDGET-9"
                },
                {
                  "step": "nfkc",
                  "output": "WIDGET-9"
                }
              ],
              "output": "WIDGET-9",
              "ucd": [
                "UnicodeData.txt 200B ; General_Category Cf",
                "UnicodeData.txt 00AD ; General_Category Cf"
              ]
            },
            {
              "step": "tuple",
              "components": [
                "iri",
                "v1",
                "sku",